00:21:33.385587 IP 192.168.1.161.36316 > 8.8.8.8.domain: 54879+ A? google.com. (28)
00:21:33.385619 IP 192.168.1.161.36316 > 8.8.8.8.domain: 20318+ AAAA? google.com. (28)
00:21:33.385933 IP 192.168.1.1 > 192.168.1.161: ICMP net 8.8.8.8 unreachable, length 64
00:21:33.386005 IP 192.168.1.161.35680 > 8.8.8.8.domain: 54879+ A? google.com. (28)
00:21:33.386026 IP 192.168.1.161.35680 > 8.8.8.8.domain: 20318+ AAAA? google.com. (28)
00:21:33.940155 IP 192.168.1.161.53689 > 8.8.8.8.domain: 4078+ PTR? 8.8.8.8.in-addr.arpa. (38)
00:21:38.411558 ARP, Request who-has 192.168.1.1 tell 192.168.1.161, length 28
00:21:38.411789 ARP, Request who-has 192.168.1.161 tell 192.168.1.1, length 46
00:21:38.411801 ARP, Reply 192.168.1.161 is-at 7a:29:39:bc:ca:7b (oui Unknown), length 28
00:21:38.412122 ARP, Reply 192.168.1.1 is-at 9e:5e:a1:d9:d2:86 (oui Unknown), length 46
00:21:38.945984 IP 192.168.1.161.53689 > 8.8.8.8.domain: 4078+ PTR? 8.8.8.8.in-addr.arpa. (38)
00:21:38.946565 IP 192.168.1.1 > 192.168.1.161: ICMP net 8.8.8.8 unreachable, length 74
00:21:38.946815 IP 192.168.1.161.56415 > 8.8.8.8.domain: 44877+ PTR? 161.1.168.192.in-addr.arpa. (44)
00:21:43.951905 IP 192.168.1.161.56415 > 8.8.8.8.domain: 44877+ PTR? 161.1.168.192.in-addr.arpa. (44)
00:21:43.952263 IP 192.168.1.1 > 192.168.1.161: ICMP net 8.8.8.8 unreachable, length 80
00:21:43.952782 IP 192.168.1.161.33084 > 8.8.8.8.domain: 48729+ PTR? 1.1.168.192.in-addr.arpa. (42)

